{
  "schema_version": "1.0",
  "status": "draft",
  "validation_id": "phylogenomics-qfo-2025-04-pilot",
  "driver": "bio-phylogenomics",
  "truth_set_id": "qfo-2025-04-reference-proteomes",
  "workdir": "REQUIRED",
  "logs_dir": "tasks/biological-validation/runs/phylogenomics-qfo-2025-04-pilot",
  "scheduler": {
    "cluster": "CHOOSE_ON_LOGIN_NODE",
    "account": "REQUIRED",
    "partition": "CHOOSE_ON_LOGIN_NODE",
    "qos": "CHOOSE_ON_LOGIN_NODE",
    "cpus": 4,
    "memory_mb": 8192,
    "time_minutes": 30
  },
  "environment": {
    "name": "phylogenomics-pixi-lock",
    "version": "TBD",
    "kind": "file",
    "path": "validation/environments/phylogenomics/pixi.lock",
    "sha256": "TBD"
  },
  "databases": [],
  "version_commands": [
    ["pixi", "run", "--manifest-path", "validation/environments/phylogenomics/pixi.toml", "mafft", "--version"],
    ["pixi", "run", "--manifest-path", "validation/environments/phylogenomics/pixi.toml", "trimal", "--version"],
    ["pixi", "run", "--manifest-path", "validation/environments/phylogenomics/pixi.toml", "iqtree3", "--version"]
  ],
  "command": [
    "pixi", "run", "--manifest-path", "validation/environments/phylogenomics/pixi.toml",
    "python", "skills/bio-phylogenomics/scripts/run_phylogenomics.py",
    "tasks/biological-validation/data/qfo/markers.tsv", "--references",
    "tasks/biological-validation/data/qfo/references.tsv", "--out",
    "tasks/biological-validation/runs/phylogenomics-qfo-2025-04-pilot/results",
    "--seed", "1729", "--execute"
  ],
  "expected_outputs": [
    {
      "path": "tasks/biological-validation/runs/phylogenomics-qfo-2025-04-pilot/results/run_manifest.json",
      "min_bytes": 100
    },
    {
      "path": "tasks/biological-validation/runs/phylogenomics-qfo-2025-04-pilot/results/marker/support.tsv",
      "min_bytes": 40
    }
  ]
}
